{
 "$schema":"https://json-schema.org/draft/2020-12/schema","type":"object","additionalProperties":false,
 "required":["schema_version","run_kind","passed","checks","config_sha256","trace_count","real_bundle_decrypted","api_inventory_performed","source_persisted","task_read","model_loaded","gpu_used","implementation_authorized","next_gate"],
 "properties":{"schema_version":{"const":1},"run_kind":{"const":"proper_v2_3_appworld_in_memory_static_api_inventory_protocol_validation"},"passed":{"type":"boolean"},"checks":{"type":"object","additionalProperties":{"type":"boolean"}},"config_sha256":{"type":"string","pattern":"^[0-9a-f]{64}$"},"trace_count":{"const":8},"real_bundle_decrypted":{"const":false},"api_inventory_performed":{"const":false},"source_persisted":{"const":false},"task_read":{"const":false},"model_loaded":{"const":false},"gpu_used":{"const":false},"implementation_authorized":{"type":"boolean"},"next_gate":{"enum":["implement_and_synthetically_validate_in_memory_static_api_inventory","stop_static_api_protocol"]}}
}
